{
  "ManifestVersion": "cw-m5-026b-continuation-authorization-v1",
  "Operation": "ProvisionDestinationTarget",
  "ApprovalId": "CW-M5-026B-DESTINATION-20261012-002",
  "ApprovedAtUtc": "2026-10-12T12:23:52Z",
  "ExpiresAtUtc": "2026-10-13T12:23:52Z",
  "Approver": {
    "Name": "Christian Daniel Jensen",
    "Role": "Project Owner"
  },
  "Operator": {
    "Name": "Christian Daniel Jensen",
    "Role": "System Administrator"
  },
  "TargetOwner": "Christian Daniel Jensen",
  "Host": {
    "HostName": "christian-laptop",
    "UnixUser": "cdjensen94",
    "Uid": 1000,
    "RootlessPodmanRequired": true
  },
  "Target": {
    "ContainerName": "continuumwiki-m5-026b-destination-ro1",
    "VolumeName": "continuumwiki-m5-026b-destination-ro1-data",
    "DatabaseName": "cw_m5_026b_destination_ro1",
    "Endpoint": "127.0.0.1:13327",
    "DatabaseIdentity": "continuumwiki_m5_026b_destination_app",
    "CredentialDirectory": "/home/cdjensen94/.local/state/continuumwiki/cw-m5-026b/destination-ro1",
    "IdentityPrefix": "milestone=CW-M5-026B;role=destination;container=continuumwiki-m5-026b-destination-ro1;volume=continuumwiki-m5-026b-destination-ro1-data;database=cw_m5_026b_destination_ro1;endpoint=127.0.0.1:13327;",
    "ImageReference": "docker.io/library/mariadb@sha256:6422478cb8e159f080fb1d8ccf65101e26fe51385787fde7d16c3b165a331f15"
  },
  "Permissions": {
    "VerifyRetainedSourceIdentity": false,
    "ProvisionDestinationTarget": true,
    "RetainSanitizedEvidence": true
  },
  "Scope": {
    "Production": false,
    "SharedWithProduction": false,
    "RehearsalRightsGranted": false,
    "BackupAllowed": false,
    "RestoreAllowed": false,
    "SchemaMigrationAllowed": false,
    "CertificationAllowed": false,
    "CleanupAllowed": false,
    "SchemaDeletionAllowed": false,
    "ContainerVolumeDeletionAllowed": false
  }
}
